{
  "schema_version": "curve.manual-plan-draft.save/v3-candidate",
  "policy_edition": "LOCAL_MANUAL_PLAN_DRAFT_RECONSTRUCTION_V3",
  "expected_draft_revision": 0,
  "approved_subject_ref": {
    "entity_id": "30000000-0000-4000-8000-000000000004",
    "digest": "sha256:dddddddddddddddddddddddddddddddddddddddddddddddddddddddddddddddd"
  },
  "definition_ref": {
    "object_id": "30000000-0000-4000-8000-000000000013",
    "digest": "sha256:d0a5d25d0f56f2936d1c812f401c39e1e30d5753eed35fc19f3c9a601ff1eda8",
    "size_bytes": 7771,
    "media_type": "application/json"
  },
  "manual_profile_ref": {
    "entity_id": "20000000-0000-4000-8000-000000000301",
    "digest": "sha256:fbfaf1ae8608aa580c5d76514a948ef515f8e0795248d180840fb89779f5a1e8"
  }
}
